<?xml version="1.0" encoding="UTF-8"?>
<!DOCTYPE EjemplorealConcesionario SYSTEM "EjemplorealConcesionario.dtd">

<Puerto>
  <Barco>
    <Codigo>001</Codigo>
    <Marca>Yamaha</Marca>
    <Modelo>Speedboat</Modelo>
    <Matricula>ABC123</Matricula>
    <Potencia>200</Potencia>
    <CapacidadPasajeros>6</CapacidadPasajeros>
    <NumeroCabinas>0</NumeroCabinas>
  </Barco>
  <Barco>
    <Codigo>002</Codigo>
    <Marca>Sea Ray</Marca>
    <Modelo>Express Cruiser</Modelo>
    <Matricula>DEF456</Matricula>
    <Potencia>350</Potencia>
    <CapacidadPasajeros>8</CapacidadPasajeros>
    <NumeroCabinas>2</NumeroCabinas>
  </Barco>
  <Barco>
    <Codigo>003</Codigo>
    <Marca>Beneteau</Marca>
    <Modelo>Oceanis</Modelo>
    <Matricula>GHI789</Matricula>
    <Potencia>150</Potencia>
    <CapacidadPasajeros>10</CapacidadPasajeros>
    <NumeroCabinas>3</NumeroCabinas>
  </Barco>
  <Barco>
    <Codigo>004</Codigo>
    <Marca>Bayliner</Marca>
    <Modelo>Bowrider</Modelo>
    <Matricula>JKL012</Matricula>
    <Potencia>180</Potencia>
    <CapacidadPasajeros>5</CapacidadPasajeros>
    <NumeroCabinas>0</NumeroCabinas>
  </Barco>
  <Barco>
    <Codigo>005</Codigo>
    <Marca>Jeanneau</Marca>
    <Modelo>Sun Odyssey</Modelo>
    <Matricula>MNO345</Matricula>
    <Potencia>130</Potencia>
    <CapacidadPasajeros>12</CapacidadPasajeros>
    <NumeroCabinas>4</NumeroCabinas>
  </Barco>
  <Barco>
    <Codigo>006</Codigo>
    <Marca>Hanse</Marca>
    <Modelo>415</Modelo>
    <Matricula>PQR678</Matricula>
    <Potencia>250</Potencia>
    <CapacidadPasajeros>8</CapacidadPasajeros>
    <NumeroCabinas>2</NumeroCabinas>
  </Barco>
  <Barco>
    <Codigo>007</Codigo>
    <Marca>Fountain</Marca>
    <Modelo>Lightning</Modelo>
    <Matricula>STU901</Matricula>
    <Potencia>450</Potencia>
    <CapacidadPasajeros>4</CapacidadPasajeros>
    <NumeroCabinas>1</NumeroCabinas>
  </Barco>
  <Barco>
    <Codigo>008</Codigo>
    <Marca>Catalina</Marca>
    <Modelo>375</Modelo>
    <Matricula>VWX234</Matricula>
    <Potencia>180</Potencia>
    <CapacidadPasajeros>6</CapacidadPasajeros>
    <NumeroCabinas>2</NumeroCabinas>
  </Barco>
  <Barco>
    <Codigo>008</Codigo>
    <Marca>Catalina</Marca>
    <Modelo>375</Modelo>
    <Matricula>VWX234</Matricula>
    <Potencia>180</Potencia>
    <CapacidadPasajeros>6</CapacidadPasajeros>
    <NumeroCabinas>2</NumeroCabinas>
  </Barco>
  <Barco>
    <Codigo>009</Codigo>
    <Marca>Yandel</Marca>
    <Modelo>378</Modelo>
    <Matricula>WUE647</Matricula>
    <Potencia>500</Potencia>
    <CapacidadPasajeros>200</CapacidadPasajeros>
    <NumeroCabinas>6</NumeroCabinas>
  </Barco>
   <Barco>
    <Codigo>010</Codigo>
    <Marca>Durant</Marca>
    <Modelo>543</Modelo>
    <Matricula>HGK332</Matricula>
    <Potencia>600</Potencia>
    <CapacidadPasajeros>400</CapacidadPasajeros>
    <NumeroCabinas>10</NumeroCabinas>
  </Barco>
</Puerto>
